,Article title,Data type
0,The landscape of lung bronchoalveolar immune cells in COVID-19 revealed by single-cell RNA sequencing,AIRR
1,B cell clonal expansion and convergent antibody responses to SARS-CoV-2,AIRR
2,"Huang, L. et al. Blood single cell immune profiling reveals the interferon-MAPK pathway mediated adaptive immune response for COVID-19",AIRR
3,Microsoft and Adaptive Biotechnologies are studying how the human immune system reacts to the coronavirus: MSNBC,AIRR
4,Immune cell profiling of COVID-19 patients in the recovery stage by single-cell sequencing,AIRR
5,New Single-Cell Technologies Help Scientists Understand COVID-19 Disease Progression,scRNAseq
